variant,ablation_category,num_total,num_evaluable,coverage,valid_output_count,valid_output_rate,hit_all,hit_mapped,exact,set_f1_macro,micro_precision,micro_recall,micro_f1,delta_hit_all_vs_full,delta_hit_mapped_vs_full,delta_exact_vs_full,delta_set_f1_macro_vs_full,same_sample_set_as_full,strict_modality_ablation,notes
full_baseline,full_baseline,4000,3972,0.9930000000,3970,0.9925000000,0.7660000000,0.7713997986,0.3204934542,0.5589033770,0.5517496304,0.5147126437,0.5325880114,0.0000000000,0.0000000000,0.0000000000,0.0000000000,true,false,Reference condition.
language_anchors_only,multimodal_input_baseline,4000,3972,0.9930000000,3947,0.9867500000,0.6280000000,0.6324269889,0.2552870091,0.4676476394,0.5858149215,0.4205747126,0.4896293323,-0.1380000000,-0.1389728097,-0.0652064451,-0.0912557376,true,false,"Simultaneously removes visual, gaze, hand, structured geometry, and timeline evidence while retaining the closed-set candidate inventory."
no_gaze,hybrid_ablation,4000,3972,0.9930000000,3991,0.9977500000,0.7170000000,0.7220543807,0.2839879154,0.5104609431,0.5071622623,0.4720689655,0.4889867841,-0.0490000000,-0.0493454179,-0.0365055388,-0.0484424340,true,false,"Structured gaze fields and gaze-derived proposals removed, but the original video can retain the visible green gaze marker; this is a structured-gaze-cue ablation, not complete gaze-modality removal."
no_hand,hybrid_ablation,4000,3972,0.9930000000,3980,0.9950000000,0.7665000000,0.7719033233,0.3179758308,0.5590530413,0.5580458323,0.5094252874,0.5326282899,0.0005000000,0.0005035247,-0.0025176234,0.0001496643,true,false,"Structured hand summary and hand/ray fields removed, but visible hands/gestures remain in the video; this is a structured-hand-cue ablation, not complete hand-modality removal."
no_visual,hybrid_ablation,4000,3972,0.9930000000,3906,0.9765000000,0.7302500000,0.7353977845,0.3147029204,0.5471510852,0.6149140693,0.4852873563,0.5424643454,-0.0357500000,-0.0360020141,-0.0057905337,-0.0117522919,true,false,"Visual evidence is removed, but video input is replaced by one 64x64 placeholder image and ablation-specific prompt text is added; input type/count/geometry therefore differ from full."
no_gaze_hand,hybrid_ablation,4000,3972,0.9930000000,3985,0.9962500000,0.7140000000,0.7190332326,0.2789526687,0.5075815008,0.5077745988,0.4691954023,0.4877232810,-0.0520000000,-0.0523665660,-0.0415407855,-0.0513218762,true,false,Removes two structured cue families simultaneously; visible gaze marker and hands can remain in video.
